{
  "contract_version": 8,
  "simulation_id": "sim_01K5TB2H8Y4P7QCWF9XKMD6RZV",
  "modality": "voice",
  "connection": {
    "agent_platform": "pipecat",
    "connection_type": "daily_room",
    "access_variant": "daily_room.pipecat_cloud",
    "config": {
      "agentName": "lakeside-front-desk"
    },
    "credentials": {
      "publicApiKey": "pk_fixture0not0a0real0public0key"
    }
  },
  "persona": {
    "name": "Eleanor",
    "personality": "Retired teacher, 68, calling from a quiet kitchen. Polite, thorough, repeats details back to be sure she has them right.",
    "parameters": {
      "language": "en-US",
      "execution_policy_version": 2,
      "background_sound_id": "none",
      "interruption_level": "none"
    }
  },
  "scenario": {
    "instructions": "Your six-month check-up is on Tuesday and you now have to be somewhere else that morning. You want it moved to any Thursday in the next month, and you want the new date read back to you before the conversation ends."
  },
  "limits": {
    "max_duration_seconds": 600,
    "max_turns": 40
  },
  "models": {
    "mode": "separate",
    "llm": {
      "provider": "openai",
      "model": "gpt-4o-mini",
      "adapter": "openai_chat_completions",
      "key": "fixture-not-a-real-secret-llm"
    },
    "stt": {
      "provider": "deepgram",
      "model": "nova-3-general",
      "adapter": "deepgram",
      "key": "fixture-not-a-real-secret-stt"
    },
    "tts": {
      "provider": "cartesia",
      "model": "sonic-3.5",
      "adapter": "cartesia",
      "voice_id": "measured-alto-3",
      "key": "fixture-not-a-real-secret-tts"
    }
  },
  "mock_tools": [
    {
      "tool_name": "check_calendar",
      "answer": {
        "answer": {
          "slots": []
        }
      }
    },
    {
      "tool_name": "cancel_booking",
      "answer": {
        "error": "the calendar service is unavailable"
      }
    }
  ],
  "pipecat_body_params": {
    "tenant": "lakeside",
    "caller": {
      "plan": "gold",
      "visits": [
        3,
        7
      ]
    }
  },
  "runtime": {
    "kind": "daytona_voice",
    "media": {
      "backend": "livekit",
      "livekit_url": "wss://egma-fixture.livekit.cloud",
      "livekit_room_name": "egma-sim-sim_01K5TB2H8Y4P7QCWF9XKMD6RZV",
      "livekit_room_token": "fixture-not-a-real-room-token",
      "livekit_api_token": "fixture-not-a-real-api-token"
    },
    "storage": {
      "backend": "s3",
      "endpoint": "https://s3.us-east-1.amazonaws.com",
      "bucket": "egma-recordings-fixture",
      "region": "us-east-1",
      "access_key_id": "fixture-not-a-real-access-key",
      "secret_access_key": "fixture-not-a-real-secret-key",
      "session_token": "fixture-not-a-real-session-token"
    }
  }
}
