{
  "contract_version": 8,
  "simulation_id": "sim_01K5TB2H8Y4P7QCWF9XKMD6RZR",
  "modality": "chat",
  "connection": {
    "agent_platform": "pipecat",
    "connection_type": "daily_room",
    "access_variant": "daily_room.pipecat_cloud",
    "config": {
      "agentName": "lakeside-front-desk"
    },
    "credentials": {
      "publicApiKey": "pk_fixture0not0a0real0public0key"
    }
  },
  "persona": {
    "name": "Eleanor",
    "personality": "Retired teacher, 68. Polite and thorough, and types the way she speaks: full sentences, and she repeats details back to be sure she has them right.",
    "parameters": {
      "language": "en-US",
      "execution_policy_version": 2,
      "background_sound_id": "none",
      "interruption_level": "none"
    }
  },
  "scenario": {
    "instructions": "Your six-month check-up is on Tuesday and you now have to be somewhere else that morning. You want it moved to any Thursday in the next month, and you want the new date read back to you before the conversation ends."
  },
  "limits": {
    "max_duration_seconds": 600,
    "max_turns": 60
  },
  "models": {
    "mode": "separate",
    "llm": {
      "provider": "openai",
      "model": "gpt-4o-mini",
      "adapter": "openai_chat_completions",
      "key": "fixture-not-a-real-secret-llm"
    },
    "stt": {
      "provider": "deepgram",
      "model": "nova-3-general",
      "adapter": "deepgram"
    },
    "tts": {
      "provider": "cartesia",
      "model": "sonic-3.5",
      "adapter": "cartesia",
      "voice_id": "measured-alto-3"
    }
  }
}
